{
    "version": "1.0.0",
    "project": {
        "name": "<projectName>",
        "alias": "<projectAlias>",
        "location": "eastus"
    },
    "servicePrincipals": [
        "SP-<projectName>-DevTest"
    ],
    "azureDevOps": {
        "organization": "<orgName>",
        "project": "<projectName>"
    },
    "environments": {
        "dev": {
            "subscriptionId": "<subscriptionId>",
            "servicePrincipalName": "SP-<projectName>-DevTest",
            "serviceConnectionName": "spn-iac-dev"
        },
        "qa": {
            "subscriptionId": "<subscriptionId>",
            "servicePrincipalName": "SP-<projectName>-DevTest",
            "serviceConnectionName": "spn-iac-qa"
        },
        "prod": {
            "subscriptionId": "<subscriptionId>",
            "servicePrincipalName": "SP-<projectName>-DevTest",
            "serviceConnectionName": "spn-iac-prod"
        }
    },
    "output": [
        {
            "template": "quickstart/mlops/configs/template.json",
            "file": "quickstart/outputs/hol.json"            
        }
    ]
}