{
    "version": "1.0.0",
    "project": {
        "name": "hlops-hol",
        "alias": "hd578dd2",
        "location": "eastus"
    },
    "servicePrincipals": [
        "SP-hlops-hol-DevTest"
    ],
    "azureDevOps": {
        "organization": "gps-devsquad",
        "project": "hlops-hol"
    },
    "environments": {
        "dev": {
            "subscriptionId": "282236ee-0d0a-4acf-bf06-b0207a1e8b11",
            "servicePrincipalName": "SP-hlops-hol-DevTest",
            "serviceConnectionName": "spn-iac-dev"
        },
        "qa": {
            "subscriptionId": "282236ee-0d0a-4acf-bf06-b0207a1e8b11",
            "servicePrincipalName": "SP-hlops-hol-DevTest",
            "serviceConnectionName": "spn-iac-qa"
        },
        "prod": {
            "subscriptionId": "282236ee-0d0a-4acf-bf06-b0207a1e8b11",
            "servicePrincipalName": "SP-hlops-hol-DevTest",
            "serviceConnectionName": "spn-iac-prod"
        }
    },
    "output": [
        {
            "template": "quickstart/configs/dataops/template.json",
            "file": "quickstart/outputs/hol.json"            
        }
    ]
}
